<!ELEMENT agenda (eventos)>
<!ELEMENT eventos (evento+)>
<!ELEMENT evento (titulo, fecha, hora, descripción)>
<!ELEMENT titulo (#PCDATA)>
<!ELEMENT fecha (#PCDATA)>
<!ELEMENT hora (#PCDATA)>
<!ELEMENT descripción (#PCDATA)>